{
  "schemaVersion": 1,
  "type": "buffercore-flavour",
  "id": "test",
  "displayName": "test",
  "description": "",
  "notes": "",
  "overrides": {
    "--bc-color-interaction-link-visited": "#4014a1",
    "--bc-color-interaction-link-visited-inverse": "#c9b6f5",
    "--bc-color-interaction-link": "#165b86",
    "--bc-color-interaction-link-inverse": "#97cdee",
    "--bc-color-interaction-focus": "#43189c",
    "--bc-color-interaction-focus-inverse": "#b194ef",
    "--bc-color-status-warning": "#dc3545",
    "--bc-color-status-warning-tint-90": "#fcebec",
    "--bc-color-status-warning-tint-80": "#f8d7da",
    "--bc-color-status-warning-tint-70": "#f5c2c7",
    "--bc-color-status-warning-tint-60": "#f1aeb5",
    "--bc-color-status-warning-tint-50": "#ee9aa2",
    "--bc-color-status-warning-tint-40": "#ea868f",
    "--bc-color-status-warning-tint-30": "#e7727d",
    "--bc-color-status-warning-tint-20": "#e35d6a",
    "--bc-color-status-warning-tint-10": "#e04958",
    "--bc-color-status-warning-shade-10": "#c6303e",
    "--bc-color-status-warning-shade-20": "#b02a37",
    "--bc-color-status-warning-shade-30": "#9a2530",
    "--bc-color-status-warning-shade-40": "#842029",
    "--bc-color-status-warning-shade-50": "#6e1b23",
    "--bc-color-status-warning-shade-60": "#58151c",
    "--bc-color-status-warning-shade-70": "#421015",
    "--bc-color-status-warning-shade-80": "#2c0b0e",
    "--bc-color-status-warning-shade-90": "#160507",
    "--bc-color-status-info": "#6b0bbf",
    "--bc-color-status-info-tint-90": "#f0e7f9",
    "--bc-color-status-info-tint-80": "#e1cef2",
    "--bc-color-status-info-tint-70": "#d3b6ec",
    "--bc-color-status-info-tint-60": "#c49de5",
    "--bc-color-status-info-tint-50": "#b585df",
    "--bc-color-status-info-tint-40": "#a66dd9",
    "--bc-color-status-info-tint-30": "#9754d2",
    "--bc-color-status-info-tint-20": "#893ccc",
    "--bc-color-status-info-tint-10": "#7a23c5",
    "--bc-color-status-info-shade-10": "#600aac",
    "--bc-color-status-info-shade-20": "#560999",
    "--bc-color-status-info-shade-30": "#4b0886",
    "--bc-color-status-info-shade-40": "#400773",
    "--bc-color-status-info-shade-50": "#360660",
    "--bc-color-status-info-shade-60": "#2b044c",
    "--bc-color-status-info-shade-70": "#200339",
    "--bc-color-status-info-shade-80": "#150226",
    "--bc-color-status-info-shade-90": "#0b0113",
    "--bc-color-status-success": "#28a745",
    "--bc-color-status-success-tint-90": "#eaf6ec",
    "--bc-color-status-success-tint-80": "#d4edda",
    "--bc-color-status-success-tint-70": "#bfe5c7",
    "--bc-color-status-success-tint-60": "#a9dcb5",
    "--bc-color-status-success-tint-50": "#94d3a2",
    "--bc-color-status-success-tint-40": "#7eca8f",
    "--bc-color-status-success-tint-30": "#69c17d",
    "--bc-color-status-success-tint-20": "#53b96a",
    "--bc-color-status-success-tint-10": "#3eb058",
    "--bc-color-status-success-shade-10": "#24963e",
    "--bc-color-status-success-shade-20": "#208637",
    "--bc-color-status-success-shade-30": "#1c7530",
    "--bc-color-status-success-shade-40": "#186429",
    "--bc-color-status-success-shade-50": "#145423",
    "--bc-color-status-success-shade-60": "#10431c",
    "--bc-color-status-success-shade-70": "#0c3215",
    "--bc-color-status-success-shade-80": "#08210e",
    "--bc-color-status-success-shade-90": "#041107",
    "--bc-color-status-error": "#ffc107",
    "--bc-color-status-error-tint-90": "#fff9e6",
    "--bc-color-status-error-tint-80": "#fff3cd",
    "--bc-color-status-error-tint-70": "#ffecb5",
    "--bc-color-status-error-tint-60": "#ffe69c",
    "--bc-color-status-error-tint-50": "#ffe083",
    "--bc-color-status-error-tint-40": "#ffda6a",
    "--bc-color-status-error-tint-30": "#ffd451",
    "--bc-color-status-error-tint-20": "#ffcd39",
    "--bc-color-status-error-tint-10": "#ffc720",
    "--bc-color-status-error-shade-10": "#e6ae06",
    "--bc-color-status-error-shade-20": "#cc9a06",
    "--bc-color-status-error-shade-30": "#b38705",
    "--bc-color-status-error-shade-40": "#997404",
    "--bc-color-status-error-shade-50": "#806104",
    "--bc-color-status-error-shade-60": "#664d03",
    "--bc-color-status-error-shade-70": "#4d3a02",
    "--bc-color-status-error-shade-80": "#332701",
    "--bc-color-status-error-shade-90": "#191301",
    "--bc-color-neutral-0": "#ffffff",
    "--bc-color-neutral-5": "#fdfdfd",
    "--bc-color-neutral-10": "#fafafb",
    "--bc-color-neutral-15": "#f8f8f9",
    "--bc-color-neutral-20": "#f5f5f7",
    "--bc-color-neutral-25": "#f3f3f5",
    "--bc-color-neutral-30": "#f0f0f3",
    "--bc-color-neutral-35": "#eeeef1",
    "--bc-color-neutral-40": "#ebebef",
    "--bc-color-neutral-45": "#e9e9ed",
    "--bc-color-neutral-50": "#e6e6eb",
    "--bc-color-neutral-55": "#cfcfd4",
    "--bc-color-neutral-60": "#b8b8bc",
    "--bc-color-neutral-65": "#a1a1a5",
    "--bc-color-neutral-70": "#8a8a8d",
    "--bc-color-neutral-75": "#737376",
    "--bc-color-neutral-80": "#5c5c5e",
    "--bc-color-neutral-85": "#454547",
    "--bc-color-neutral-90": "#2e2e2f",
    "--bc-color-neutral-95": "#171717",
    "--bc-color-neutral-100": "#000000",
    "--bc-color-ground-ramp-1": "#faf7f2",
    "--bc-color-ground-ramp-2": "#fefefe",
    "--bc-color-ground-ramp-3": "#00002a",
    "--bc-color-identity-ramp-1": "#5100ff",
    "--bc-color-identity-ramp-1-tint-90": "#eee6ff",
    "--bc-color-identity-ramp-1-tint-80": "#dcccff",
    "--bc-color-identity-ramp-1-tint-70": "#cbb3ff",
    "--bc-color-identity-ramp-1-tint-60": "#b999ff",
    "--bc-color-identity-ramp-1-tint-50": "#a880ff",
    "--bc-color-identity-ramp-1-tint-40": "#9766ff",
    "--bc-color-identity-ramp-1-tint-30": "#854dff",
    "--bc-color-identity-ramp-1-tint-20": "#7433ff",
    "--bc-color-identity-ramp-1-tint-10": "#621aff",
    "--bc-color-identity-ramp-1-shade-10": "#4900e6",
    "--bc-color-identity-ramp-1-shade-20": "#4100cc",
    "--bc-color-identity-ramp-1-shade-30": "#3900b3",
    "--bc-color-identity-ramp-1-shade-40": "#310099",
    "--bc-color-identity-ramp-1-shade-50": "#290080",
    "--bc-color-identity-ramp-1-shade-60": "#200066",
    "--bc-color-identity-ramp-1-shade-70": "#18004d",
    "--bc-color-identity-ramp-1-shade-80": "#100033",
    "--bc-color-identity-ramp-1-shade-90": "#080019",
    "--bc-color-identity-ramp-2": "#000035",
    "--bc-color-identity-ramp-2-tint-90": "#e6e6eb",
    "--bc-color-identity-ramp-2-tint-80": "#ccccd7",
    "--bc-color-identity-ramp-2-tint-70": "#b3b3c2",
    "--bc-color-identity-ramp-2-tint-60": "#9999ae",
    "--bc-color-identity-ramp-2-tint-50": "#80809a",
    "--bc-color-identity-ramp-2-tint-40": "#666686",
    "--bc-color-identity-ramp-2-tint-30": "#4d4d72",
    "--bc-color-identity-ramp-2-tint-20": "#33335d",
    "--bc-color-identity-ramp-2-tint-10": "#1a1a49",
    "--bc-color-identity-ramp-2-shade-10": "#000030",
    "--bc-color-identity-ramp-2-shade-20": "#00002a",
    "--bc-color-identity-ramp-2-shade-30": "#000025",
    "--bc-color-identity-ramp-2-shade-40": "#000020",
    "--bc-color-identity-ramp-2-shade-50": "#00001b",
    "--bc-color-identity-ramp-2-shade-60": "#000015",
    "--bc-color-identity-ramp-2-shade-70": "#000010",
    "--bc-color-identity-ramp-2-shade-80": "#00000b",
    "--bc-color-identity-ramp-2-shade-90": "#000005",
    "--bc-color-identity-ramp-3": "#ff401a",
    "--bc-color-identity-ramp-3-tint-90": "#ffece8",
    "--bc-color-identity-ramp-3-tint-80": "#ffd9d1",
    "--bc-color-identity-ramp-3-tint-70": "#ffc6ba",
    "--bc-color-identity-ramp-3-tint-60": "#ffb3a3",
    "--bc-color-identity-ramp-3-tint-50": "#ffa08d",
    "--bc-color-identity-ramp-3-tint-40": "#ff8c76",
    "--bc-color-identity-ramp-3-tint-30": "#ff795f",
    "--bc-color-identity-ramp-3-tint-20": "#ff6648",
    "--bc-color-identity-ramp-3-tint-10": "#ff5331",
    "--bc-color-identity-ramp-3-shade-10": "#e63a17",
    "--bc-color-identity-ramp-3-shade-20": "#cc3315",
    "--bc-color-identity-ramp-3-shade-30": "#b32d12",
    "--bc-color-identity-ramp-3-shade-40": "#992610",
    "--bc-color-identity-ramp-3-shade-50": "#80200d",
    "--bc-color-identity-ramp-3-shade-60": "#661a0a",
    "--bc-color-identity-ramp-3-shade-70": "#4d1308",
    "--bc-color-identity-ramp-3-shade-80": "#330d05",
    "--bc-color-identity-ramp-3-shade-90": "#190603"
  },
  "semanticMappings": {
    "colour": {
      "light": {}
    }
  }
}
